,text,id
0,"Democrats are smiling in D.C. that the Freedom Caucus, with the help of Club For Growth and Heritage, have saved Planned Parenthood &amp; Ocare!",845974102619906048
1,General Kelly is doing a great job at the border. Numbers are way down. Many are not even trying to come in anymore.,846166053663191040
2,"The race for DNC Chairman was, of course, totally ""rigged."" Bernie's guy, like Bernie himself, never had a chance. Clinton demanded Perez!",835814988686233601
3,For first time the failing @nytimes will take an ad (a bad one) to help save its failing reputation. Try reporting accurately &amp; fairly!,835817351178301440
4,"Russia talk is FAKE NEWS put out by the Dems, and played up by the media, in order to mask the big election defeat and the illegal leaks!",835916511944523777
5,"Big dinner with Governors tonight at White House. Much to be discussed, including healthcare.",835946001873657858
6,"Congressman John Lewis should spend more time on fixing and helping his district, which is in horrible shape and falling apart (not to......",820251730407473153
7,"mention crime infested) rather than falsely complaining about the election results. All talk, talk, talk - no action or results. Sad!",820255947956383744
8,"INTELLIGENCE INSIDERS NOW CLAIM THE TRUMP DOSSIER IS ""A COMPLETE FRAUD!""  @OANN",820257714362314753
9,Congressman John Lewis should finally focus on the burning and crime infested inner-cities of the U.S. I can use all the help I can get!,820425770925338624
10,"Inauguration Day is turning out to be even bigger than expected. January 20th, Washington D.C. Have fun!",820450166331346944
11,"I am now going to the brand new Trump International, Hotel D.C. for a major statement.",776773380414537728
12,Another health insurer is pulling back due to 'persistent financial losses on #Obamacare plans.' Only the beginning! https://t.co/YqfaEvg8c3,765623972234948608
13,"'It's just a 2-point race, Clinton 38%, Trump 36%' https://t.co/EzDzJ4EzIN",765629939811020802
14,This is my pledge to the American people: https://t.co/Jb21oyNfxt,765679267086684161
15,"Just as we won the Cold War, in part, by exposing the evils of communism and the virtues of free markets.... Cont: https://t.co/SXp7efXEZU",765688915932045313
16,Will be on @SeanHannity tonight at 10pmE - delivering an important speech live from Wisconsin. #MakeAmericaGreatAgain,765726909925851136
17,"@THEREALMOGUL: 41% of American voters believe the  election could be stolen"" from DonaldTrump due to widespread voter fraud. - Politico""",788342075582328832
18,"I will Make Our Government Honest Again -- believe me. But first, I'm going to have to #DrainTheSwamp in DC. https://t.co/m1lMAQPnIb",788402585816276992
19,Pay-to-play. Collusion. Cover-ups. And now bribery? So CROOKED. I will #DrainTheSwamp. https://t.co/FNzMit7mD8,788402786970939392
20,"If we let Crooked run the govt, history will remember 2017 as the year America lost its independence. #DrainTheSwamp https://t.co/VpYiO8CnXQ",788403448593002496
21,"The failing @nytimes does not mention the new @CNN Poll that has me leading Iowa by a massive 13 points - I am at 33%. Maggie Haberman, sad!",674560648790089728
22,The last person corrupt Hillary Clinton wants to run against is Donald J. Trump. I'll end up beating her in every state. New Fox Poll-Trump!,674577809877147648
23,Hillary Clinton does not have the STRENGTH or STAMINA to be President. We need strong and super smart for our next leader - or trouble!,674578580681134080
24,"@ray_aub:  @nytimes @CNN People forget the policies of leaders like @JebBush allowed 9/11 killers to immigrate, drive, &amp; pilot planes",674578805906931712
25,@ssheaver: @realDonaldTrump @nytimes @CNN https://t.co/QrsEZy8U3e Wow!,674578928741257216
26,"@mysteriousLoser: @realDonaldTrump did you hear the mayor nutter of philadelphias comments towards you? Ignorance Yes, he is a crude dope!",674579252956815360
27,I told you @TIME Magazine would never pick me as person of the year despite being the big favorite They picked person who is ruining Germany,674587800835092480
28,Rupert Murdoch Defends Trump: 'Complete Refugee Pause' Makes Sense'  https://t.co/HWOLO4RVAC,674610092344496128
29,I will be interviewed on @foxandfriends at 7:00 A.M. Enjoy!,719476340576100353
30,@TimeHasCome1: @WayneDupreeShow @ThePatriot143 Trump needs to hold a massive protest rally in Colorado. He'd get 100k &amp; own the news cycle,719484455556161538
31,@autoprofessor17: @realDonaldTrump Great job on Fox n Friends this morning. Very well spoken and presidential. #TrumpTrain,719484713182838784
32,@WVTTS1017: @realDonaldTrump just listened to you on fox. I love you so much.  Thank you!,719484822834581504
33,"@AnnesLimo: @realDonaldTrump @WVTTS1017 Thanks for Rochester rally.  Great people, thank you!",719500540657459201
34,"Big wins in West Virginia and Nebraska. Get ready for November - Crooked Hillary, who is looking very bad against Crazy Bernie, will lose!",730342411835195393
35,I don't want to hit Crazy Bernie Sanders too hard yet because I love watching what he is doing to Crooked Hillary. His time will come!,730343346204508160
36,Goofy Elizabeth Warren has been one of the least effective Senators in the entire U.S. Senate. She has done nothing!,730401662574182405
37,"Thank you to Donald Rumsfeld for the endorsement. Very much appreciated. Clinton's conduct has been ""disqualifying.""",745967990236143616
38,Hillary Clinton may be the most corrupt person ever to seek the presidency.  --   Donald J. Trump,745969049943875585
39,"ISIS threatens us today because of the decisions Hillary Clinton has made along with President Obama.""  --  Donald J. Trump",745969778267926532
40,Hillary Lies to Benghazi Families #CrookedHillary  https://t.co/YWd5lk5skG,746026900502487040
41,"As election looms, some bad news for Clinton, Democrats: https://t.co/7aWWVQPjTo",790923701193768960
42,#Obamacare premiums are about to SKYROCKET --- again. Crooked H will only make it worse. We will repeal &amp; replace! https://t.co/fY1REYV4rK,790924363348541445
43,#Obamacare premiums to jump 25% next year: https://t.co/TCdHEdPQDG  Follow us: @politico on Twitter | Politico on Facebook,790925502911578112
44,Key Obamacare premiums to jump 25% next year: https://t.co/TCdHEdPQDG,790925669937123328
45,Get out and vote! I am your voice and I will fight for you! We will make America great again! https://t.co/XXvLRlhSaz,790927104921767940
46,#ObamacareFail https://t.co/Mb0YW1rg6g,790936027871477764
47,#ObamacareFail https://t.co/5Zvsys8j5w,790936360953716736
48,Obamacare is a disaster! Time to repeal &amp; replace! #ObamacareFail  https://t.co/xDPhVczf1g,790936603590033408
49,#ObamacareFail https://t.co/90Aixp25Oc,790948782288596992
50,Obamacare is a disaster - as I've been saying from the beginning. Time to repeal &amp; replace!  #ObamacareFail https://t.co/5CvoMbVceT,790951230906458113
51,"The Bernie Sanders supporters are furious with the choice of Tim Kaine, who represents the opposite of what Bernie stands for. Philly fight?",756798838900396032
52,"Tim Kaine is, and always has been, owned by the banks. Bernie supporters are outraged, was their last choice. Bernie fought for nothing!",756799923648102400
53,"Pocahontas wanted V.P. slot so badly but wasn't chosen because she has done nothing in the Senate. Also, Crooked Hillary hates her!",756801575193042944
54,"Leaked e-mails of DNC show plans to destroy Bernie Sanders. Mock his heritage and much more. On-line from Wikileakes, really vicious. RIGGED",756804886038192128
55,Crooked Hillary Clinton has destroyed jobs and manufacturing in Pennsylvania. Against steelworkers and miners. Husband signed NAFTA.,756864330054893568
56,Funny that the Democrats would have their convention in Pennsylvania where her husband and her killed so many jobs. I will bring jobs back!,756866912848584704
57,Tim Kaine has been praising the Trans Pacific Partnership and has been pushing hard to get it approved. Job killer!,756875689924694016
58,I will bring jobs back and get wages up. People haven't had a real wage increase in almost twenty years. Clinton killed jobs!,756883131685273605
59,Just saw Crooked Hillary and Tim Kaine together. ISIS and our other enemies are drooling. They don't look presidential to me!,756952917152784384
60,"The Wikileakes e-mail release today was so bad to Sanders that it will make it impossible for him to support her, unless he is a fraud!",756959549333143552
61,"The Wikileaks e-mail release today was so bad to Sanders that it will make it impossible for him to support her, unless he is a fraud!",756962332228612096
62,Thank you to everyone for the wonderful reviews of my speech on Thursday night. From the heart!,756973646216884225
63,@OliMauritania: @realDonaldTrump Kaine supported the stupidest deal in the history of deals https://t.co/0FFeKTsuJn #HillaryKaine2016,756974970312462336
64,@NancyNielsenn: @realDonaldTrump Dinesh D'Sousa Hillary's America. see it,756975589110779904
65,#MakeAmericaGreatAgain #TrumpPence16 https://t.co/gCzHX1nyxD,757012114460569604
66,"@keksec_org: @realDonaldTrump Ivanka said it and you said it too, you'll be great for women. #MakeAmericaGreatAgain",662559770398838784
69,"@Rick_Sa: @greta Interesting presidential race; Carson tries to beat his mom with a hammer, and @realDonaldTrump beats Carson in the polls!	2015-11-06 11:37:59	android
662567885051699200	realDonaldTrump	@reganharycki: @realDonaldTrump it's about time we find a republican that can take on the democrats! https://t.co/lfI1rUjWRV""",662564576265953280
70,@GrundleMan27: Marco Rubio can't even handle his own credit card how is he going to be able to handle the U.S. finances #trump,662568726282268673
71,@AliceEngle3: @realDonaldTrump-huge lead in Reuters National poll https://t.co/afdvXHzvIx,662569633258541056
72,@rhinostate: .@realDonaldTrump @GrundleMan27 Rubio is a Manchurian Candidate. People will own him if he ever became president.,662569952126349312
73,Florida Ethics Commission Advocate comes down hard on Rubio. So do two people who worked with him. Said he used the wrong credit card! Sure.,662599915596554240
74,Will be interviewed on @MariaBartiromo on @FoxBusiness at 7:25 this morning! Enjoy.,662600422339780608
75,"Such bad reporting: A puff piece on Ben Carson in the @nytimes states that Carson ""is trying to solidify his lead."" But I am #1, easily! Sad",662604464830988288
76,"With Ben Carson wanting to hit his mother on head with a hammer, stabb a friend and Pyramids built for grain storage - don't people get it?",662606063624032257
77,"Carson now admits his friend named ""Bob,"" who he tried to stabb (Bob was saved by his belt buckle!), no longer exists as Bob. Wrong name!",662619382808489984
78,"With Ben Carson wanting to hit his mother on head with a hammer, stab a friend and Pyramids built for grain storage - don't people get it?",662632599962173440
79,"Carson now admits his friend named ""Bob,"" who he tried to stab (Bob was saved by his belt buckle!), no longer exists as Bob. Wrong name!",662632702227648512
80,@CASuperrunner: @cu_mr2ducks @FoxNews @foxnewspolitics  Trump talked about this weeks ago as a possibility .... this is not Rubio's idea,651245719190437888
81,I will be interviewed on @CNN New Day at 7:03 A.M. Enjoy!,651350101823221760
82,@LarrySchweikart: @peddoc63 @RickCanton @realDonaldTrump @marcorubio Funny. The Donald living rent-free in lil Marco's head,651359165349281792
83,@Karentalk: @CNNPolitics @realDonaldTrump Stop interrupting Trump..Please..He is CORRECT ON EVERYTHING..,651359196563251200
84,@LindaRicker6: My choice @realDonaldTrump just finished a great interview on CNN. Pathetic questions from Cuomo but Trump cleared the air.,651359270353698816
85,"@AngelaDale143: @realDonaldTrump @CNN wow, did Trump kick ass with Cuomo! You are the man, Mr. Trump; certainly not the lamb chop, Rubio.",651359481864036352
86,@realbigstriper: @ChrisCuomo Pew poll: @realDonaldTrump holds commanding lead @CNNPolitics http://t.co/iw2vk9Wx9L,651359555528601600
87,@Lisa_Steen: seriously Cuomo hates DonaldTrump he was a pathetic interviewer AS USUAL! Please don't go anywhere Mr Trump AMERICA NEEDS YOU,651359752484691968
88,"@Tea4Freedom: @realDonaldTrump @CNN That was awesome, boss! #trump2016",651359857136824320
89,@Nay_2xTimes: Great interview on #NewDay @realDonaldTrump #MakeAmericaGreatAgain,651360060396937216
90,"@AJ_Nix: @realDonaldTrump @CNN Great job Mr Trump,,,Kept em on topic,, Got your message though.",651360322201210880
91,@jpm05880: @realDonaldTrump @CNN TRUMP EVEN SHARPER THAN LAST WEEK!!YOU ARE BEAUTIFUL...,651360673180569604
92,"@WMikeWood: @cnn Trump Shuts down Cuomo. I am not getting out."" I am going to win. Cuomo tries sleazy tricks . Epic Fail. Unprofessional.""",651360905578577920
93,@CPO_Mark_2010: @realDonaldTrump is fired up on @cnn!!! So are your supporters!! #Trump2016,651361060960759808
94,@SteveBrainard1: @realDonaldTrump @CNN great interview Trump!,651361170234994688
95,@kitkat123frank: @realDonaldTrump @CNN @SpecialKMB1969. You have my vote,651361204460519424
96,".@WayneNewtonMrLV  Wayne, such a pleasant surprise--so nice. Thank you very much.",651412375250280448
97,"So many ""politically correct"" fools in our country. We have to all get back to work and stop wasting time and energy on nonsense!",629992743788523520
98,"Re Megyn Kelly quote: ""you could see there was blood coming out of her eyes, blood coming out of her wherever"" (NOSE). Just got on w/thought",629997060830425088
99,".@redstate I miss you all, and thanks for all of your support. Political correctness is killing our country. ""weakness.""",630007166129303552
100,"Wow, CNN just said that Donald Trump won the DEBATE, connected best with audience. Also, Time, Drudge, Newsmax, N.Y.Times and more!",630100913861099520
101,"Almost universal support that ""Trump won the debate."" Only @FoxNews is consistantly fighting the Trump win, and I got them the ratings!",630116339852673024
102,"Small crowds at @RedState today in Atlanta. People were very angry at EWErickson, a major sleaze and buffoon who has saved me time and money",630223393774825472
103,Somebody with aptitude and conviction should buy the FAKE NEWS and failing @nytimes and either run it correctly or let it fold with dignity!,825690087857995776
104,"Our country needs strong borders and extreme vetting, NOW. Look what is happening all over Europe and, indeed, the world - a horrible mess!",825692045532618753
105,".@JebBush is a sad case. A total embarrassment to both himself and his family, he just announced he will continue to spend on Trump hit ads!",683259029804695552
106,".@JebBush is a low energy ""stiff"" who should focus his special interest money on the many people ahead of him in the polls. Has no chance!",683260753810440192
107,"Hillary Clinton said that it is O.K. to ban Muslims from Israel by building a WALL, but not O.K. to do so in the U.S. We must be vigilant!",683277309969694720
108,"Hillary Clinton doesn't have the strength or stamina to be president. Jeb Bush is a low energy individual, but Hillary is not much better!",683377290282156032
109,I hope Bill Clinton starts talking about women's issues so that voters can see what a hypocrite he is and how Hillary abused those women!,683378470093746176
110,"When I look at all of the money the special interests and lobbyists are giving to candidates, beware - the candidates are mere puppets $$$$!",683392613869858816
111,"Remember, I am self-funding my campaign, the only one in either party. I'm not controlled by lobbyists or special interests-only the U.S.A.!",683394224184758272
112,"Heading to Biloxi, Mississippi. Massive crowds expected. Thank you for your support! #VoteTrump2016 https://t.co/1VMngEMLzT",683418056417251328
113,Just arrived in Mississippi for the rally. Word is that the crowd is overflowing and massive. Will be an amazing evening!,683443848639455232
114,Will be interviewed on @foxandfriends at 8:00 A.M.,668402717241548800
115,.@GStephanopoulos just announced that I am leading  BIG in the new @ABC Poll which will be shown on This Week at 9:00 A.M. I will be on show,668405215654240256
116,Big new @ABC Poll to be announced at 9:00 A.M. on This Week with @GStephanopoulos. I will be interviewed on show!,668406922232659968
117,.@foxandfriends  at 8:00 A.M.,668410956725272576
118,Great poll numbers all over and beating Hillary Clinton one on one. Thank you!,668441539643899905
119,13 Syrian refugees were caught trying to get into the U.S. through the Southern Border. How many made it?  WE NEED THE WALL!,668457318267400193
120,"We better get tough with RADICAL ISLAMIC TERRORISTS, and get tough now, or the life and safety of our wonderful country will be in jeopardy!",668458837670805504
121,Great poll numbers! Thank you! #MakeAmericaGreatAgain #Trump2016 https://t.co/51CRR6m5Eg,668495716139036673
122,"@heiressarts: @realDonaldTrump By going after you, Jindal also lost the LA governor race! Politicians Beware.	2015-11-22 21:59:17	android
668520614697820160	realDonaldTrump	@SeanSean252: @WayneDupreeShow @Rockprincess818 @CheriJacobus    https://t.co/5GUwhhtvyN""",668519137765928960
123,@jakub_lisa:  @HillaryClinton A Clinton Cannot be trusted!How many x's do we allow them to disgrace this country? #NoClintonInWHEverAgain,668520845028040704
124,"@drewtheg:  Trump is the epitome of integrity, good spirit, forthright honesty... you pull no punches and call a spade a spade. diggin it!",668521121411678208
125,@TheFix: The Paris attacks have only made Donald Trump stronger https://t.co/F8vgxYNa5t https://t.co/Y3SevhrRp1 Very interesting!,668556086547496960
126,@MJP1370: @realDonaldTrump @TheFix @pbump We need Trump now! Obama isn't protecting Americans !!,668557606189944832
127,@bloggerjulie: @FoxNews The reporter is the one who mentioned the national database FIRST and not DonaldTrump. Y not report HONEST NEWS?,668557747336687616
128,"@jrpantiques: @realDonaldTrump @TheFix @pbump THE SCRIPT FOR A GREAT WORLD CHANGING LEADER TO ARISE HAS BEEN WRITTEN &amp; IT WAS FOR MR. TRUMP	2015-11-23 00:33:42	android
668560227772604416	realDonaldTrump	@ktd101551: @CNNPolitics Trump gave a great speech in Ala. What's more important a protester? I wouldn't give these folks 1 sec of attn""",668557999179472896
129,@ny_conservative:  @BarbMuenchen #CrippledAmerica is an excellent resource for the 2016 race #TeamTrump #Trump2016 #MakeAmericaGreatAgain,668561163920277504
130,"Hillary Clinton is weak on illegal immigration, among many other things. She is strong on corruption - corruption is what she's best at!",668563843904380928
131,".@MatthewJDowd thank you for the nice comments recently, especially on @BarbaraJWalters. My family &amp; I greatly appreciate your kind words.",668594331968778241
132,@mygreenhippo #BenCarson is now leading in the #polls in #Iowa. Too much #Monsanto in the #corn creates issues in the brain? #Trump #GOP,657224175707385856
133,Trump Nears 100 days on Top via The Hill https://t.co/MDzpY89TRE,657228886007263233
134,"#ChrisWallace, who interviewed me on Sunday, had his highest ratings since Feb of '09. Congratulations!  https://t.co/o49V73AZZB",657231408813993984
135,@toddinwichita @realDonaldTrump Hillary is doing a HORRIBLE job at #BenghaziHearings reading from the script. #pathetic . She is no leader,657235829413289984
136,"Joe, thanks for not running! https://t.co/yYAMVXWc7t",657238490476843008
137,The young intern who accidentally did a Retweet apologizes.,657270071979585536
138,@dpdax @realDonaldTrump Thanks for standing for Vets Take care of those that give so much,657298874869096448
139,Look at the way Crooked Hillary is handling the e-mail case and the total mess she is in. She is unfit to be president. Bad judgement!,793400131525677056
140,"Wow, now leading in @ABC /@washingtonpost Poll 46 to 45. Gone up 12 points in two weeks, mostly before the Crooked Hillary blow-up!",793421274043285504
141,"Crooked Hillary should not be allowed to run for president. She deleted 33,000 e-mails AFTER getting a subpoena from U.S. Congress. RIGGED!",793422633111023616
142,Thank you! Together we will #MakeAmericaGreatAgain! https://t.co/7Jk6voyzue,740313748825505792
143,I will be interviewed tonight on @seanhannity - Enjoy!  10:00 P.M.,740330660372619265
144,I will be speaking about our great journey to the Republican nomination at 9:00 P.M. The movement toward a country that WINS again continues,740343009074634752
145,Thank you Montana! #Trump2016 https://t.co/rOvTapLnWG https://t.co/PyHiy7vjO6,740380953722421249
146,Thank you New Jersey! #Trump2016 https://t.co/PgIYkHLGtI https://t.co/MyJMOKdpJ9,740383281603039232
147,Thank you South Dakota! #Trump2016  https://t.co/GbRTQdxIj4 https://t.co/pNqwOrY0ZB,740385872089120768
148,Thank you New Mexico! #Trump2016 https://t.co/wNOY8Pc2kM https://t.co/osWzVxNkJx,740387780719747072
149,Thank you California! #Trump2016  https://t.co/GusL2UPrX2 https://t.co/H6D25S1TR5,740392765662629888
150,"Crooked H is nasty to Sanders supporters behind closed doors. Owned by Wall St and Politicians, HRC is not with you. https://t.co/WN1lyCDXla",782264189574377472
151,"I won the debate if you decide without watching the totally one-sided ""spin"" that followed. This despite the really bad microphone.",782313153308884992
152,The so-called Commission on Presidential Debates admitted to us that the DJT audio &amp; sound level was very bad. So why didn't they fix it?,782321125984436224
153,"Wow, just saw the really bad @CNN ratings. People don't want to watch bad product that only builds up Crooked Hillary.",782330717539803136
154,Heading to Pennsylvania for a big rally tonight. We will MAKE AMERICA GREAT AGAIN!,782331741369462784
155,"Great being in Cincinnati, Ohio last night- thank you! Off to Washington D.C. now. #Trump2016 #AmericaFirst https://t.co/sryJgRyd56",751016366925344768
156,Just leaving D.C. Had great meetings with Republicans in the House and Senate. Very interesting day! These are people who love our country!,751115433273688064
157,"Wow, my poll numbers have just been announced and have gone through the roof!",674917524597825536
158,I will be interviewed on @foxandfriends this morning at 7:30. So much to talk about!,674919175681400832
159,"Our VISA system is broken, like so much else in our country. We better get it fixed really fast. MAKE AMERICA GREAT AGAIN!",674921565717438464
160,I have decided to postpone my trip to Israel and to schedule my meeting with @Netanyahu at a later date after I become President of the U.S.,674924540347195392
161,.@foxandfriends NOW!,674928839173259265
162,"The United Kingdom is trying hard to disguise their massive  Muslim problem. Everybody is wise to what is happening, very sad! Be honest.",674934005725331456
163,Thank you to respected columnist Katie Hopkins of Daily https://t.co/LgtY0qdv9U for her  powerful writing on the U.K.'s Muslim problems.,674936832010887168
164,The politicians of the U.K. should watch Katie Hopkins of Daily https://t.co/LgtY0qdv9U on @FoxNews. Many people in the U.K. agree with me!,674938181918269441
165,@Sharp_Trident: A huge disappointment to see @megynkelly constantly attack DonaldTrump. It has become almost unbearable to watch her show.,691850438119952385
166,"I will be doing @GMA @GStephanopoulos this morning at around 7:00. Likewise, I will be doing @Morning_Joe at around 7:00. Figure it out!",691934371654270976
167,@laurencristmann:  @Sharp_Trident @megynkelly it makes me not wanna watch debate because I know they are going to treat Trump unfair,691942336746635264
168,I will be interviewed by @MariaBartiromo on @MorningsMaria  @FoxBusiness at 7:30 A.M. Enjoy.,691943033663782912
169,RT @Morning_Joe: VIDEO: @realDonaldTrump announces 'a very powerful endorsement' will be coming today.  https://t.co/cJsMBcVcdY,691965633043513345
170,Donald Trump retains national lead in new ABC News/WaPo poll with 37%: https://t.co/xPjA3TBbTa https://t.co/6Uaecpwqwm,691966649973522432
171,@realDonaldTrump hits new heights in national poll at 41% https://t.co/1Tzszrkh4j,691967215097221120
172,"@xXFlame: .@bobvanderplaats Idiot Bob Plaats on CNN is DELUDED! Cruz's favorability ratings are 0%, NO ONE LIKES HIM. VOTE TRUMP INSTEAD!",691992417336172544
173,@AynsFriend: @bobvanderplaats CRUZ IS DONE @CNN @ChrisCuomo,691992472889724929
174,@puttster71: @bobvanderplaats The next president isn't on ur stage. @realDonaldTrump is the next president.,691992813177847808
175,I will end common core. It's a disaster. https://t.co/d83XYrqZ3m #MakeAmericaGreatAgain #Trump2016 https://t.co/r0Sc6zm80I,692000115800825858
176,Why doesn't phony  @bobvanderplaats tell his followers all the times he asked for him and his family to stay at my hotels-didn't like paying,692012875775414273
177,"For the great people of Iowa, find your #IACaucus location at https://t.co/ANvTcZqfOq - so important to vote! #MakeAmericaGreatAgain",692018253678415873
178,#MakeAmericaGreatAgain #Trump2016  https://t.co/oJyGTj5QX8,692025339812380672
179,"Great honor- Rev. Jerry Falwell Jr. of Liberty University, one of the most respected religious leaders in our nation, has just endorsed me!",692028126189199360
180,We don't have a country- if we don't have borders. #VoteTrump  Video: https://t.co/wG4RgOi1bW https://t.co/oAXBvcKIsr,709362309819404289
181,"Look forward to being in Tampa this afternoon. Wonderful crowds. Thank you, Florida!",709399753545670656
182,Leaving the great people of North Carolina. Amazing event. Heading to Tampa now! #VoteTrump,709422865360297984
183,"Gov Kasich voted for NAFTA, which devastated Ohio and is now pushing TPP hard- bad for American workers!",709423676425379841
184,Kasich has helped decimate the coal and steel industries in Ohio. I will bring them back! #MakeAmericaGreatAgain,709423812681531392
185,Lightweight @JebBush said tonight he didn't know his family used private eminent domain in Texas- Lie!  #GOPDebate,698739578002403328
